{
  "$schema": "https://json-schema.org/draft/2020-12/schema",
  "$id": "plugin.schema.json",
  "title": "DHIS2 Android plugin identity",
  "description": "Who this plugin is. The build reads it in settings.gradle.kts; tools/identity.py reads it for the Python gates. Nothing else may repeat these values \u2014 tools/check-identity.py fails when the source tree and this file disagree.",
  "type": "object",
  "required": [
    "name",
    "slug",
    "pluginId",
    "package",
    "entryPoint",
    "version",
    "injectionPoints"
  ],
  "additionalProperties": false,
  "properties": {
    "$schema": {
      "type": "string"
    },
    "name": {
      "description": "Display name, shown in the harness and used as the card's default title.",
      "type": "string",
      "minLength": 1
    },
    "slug": {
      "description": "Gradle rootProject.name. Kebab-case: a space here reaches Compose Resources as a backtick-escaped package.",
      "type": "string",
      "pattern": "^[a-z0-9][a-z0-9-]*$"
    },
    "pluginId": {
      "description": "Reverse-domain id the server dataStore config names. Hyphens allowed, unlike the Kotlin package.",
      "type": "string",
      "pattern": "^[a-z][a-z0-9]*(\\.[a-z0-9][a-z0-9-]*)+$"
    },
    "package": {
      "description": "Kotlin package root. Also the Android namespace, and the stem of resourcePackage and harnessApplicationId.",
      "type": "string",
      "pattern": "^[a-z][a-z0-9_]*(\\.[a-z][a-z0-9_]*)+$"
    },
    "entryPoint": {
      "description": "Simple class name of the Dhis2Plugin implementation. Its FQCN is package + '.' + entryPoint.",
      "type": "string",
      "pattern": "^[A-Z][A-Za-z0-9]*$"
    },
    "version": {
      "description": "The plugin's version. The Capture App caches bundles by {id}-{version}.zip, so a change shipped at an unchanged version keeps running the old code on device.",
      "type": "string",
      "pattern": "^[0-9]+\\.[0-9]+\\.[0-9]+([-.][0-9A-Za-z.-]+)?$"
    },
    "injectionPoints": {
      "description": "Host slots this plugin renders in, written into the generated plugin-config.json. Only slots plugin-sdk defines are honoured \u2014 an app that has never heard of one drops it when it reads the config, leaving the plugin rendering nowhere. check-identity.py enforces the list.",
      "type": "array",
      "items": {
        "enum": [
          "HOME_ABOVE_PROGRAM_LIST",
          "DATA_SET_INSTANCE_CONTENT"
        ]
      },
      "minItems": 1
    },
    "slotConfig": {
      "description": "Per-slot configuration, keyed by injection point, written into the generated plugin-config.json. Replacement slots render nowhere until it says which objects they apply to. A rendering filter, never an access grant \u2014 it narrows nothing about what the plugin can read or write.",
      "type": "object",
      "additionalProperties": false,
      "properties": {
        "DATA_SET_INSTANCE_CONTENT": {
          "description": "Which data set instances this plugin draws the body of. An empty list replaces nothing, so it doubles as a kill switch that does not require deleting the plugin's entry.",
          "type": "object",
          "additionalProperties": false,
          "properties": {
            "dataSetUids": {
              "type": "array",
              "items": {
                "type": "string",
                "pattern": "^[A-Za-z][A-Za-z0-9]{10}$"
              }
            }
          }
        }
      }
    },
    "conventions": {
      "description": "Where this plugin's own architecture rules apply. {packagePath} and {entryPoint} are expanded. tools/check-rules.py reads these instead of hardcoding filenames.",
      "type": "object",
      "additionalProperties": false,
      "properties": {
        "sdkAllowed": {
          "description": "The only files permitted to mention org.hisp.dhis.android \u2014 the repository implementations. Keeping D2 out of UI and domain code is what keeps them unit-testable and previewable. Adding a path here is a decision worth a commit message.",
          "type": "array",
          "items": {
            "type": "string"
          }
        },
        "repositoryInterfaces": {
          "description": "Interfaces whose every function must return Result \u2014 an exception reaching the host composition takes the enclosing screen with it.",
          "type": "array",
          "items": {
            "type": "string"
          }
        }
      }
    },
    "template": {
      "type": "object",
      "additionalProperties": false,
      "properties": {
        "formatVersion": {
          "type": "integer"
        },
        "initialised": {
          "description": "False while ./init.sh is mid-run, so a crash leaves an unambiguously partial repo rather than a silently broken one.",
          "type": "boolean"
        }
      }
    }
  }
}
